Movie_ID,Title,Genre,Release_Year,Duration,Rating,IMDb_Rating,Votes,Director,Country,Language,Budget,Revenue,Date_Added,Age_Rating,Cast,Production_House
NF8997,  Birds of Prey  ,"Horror,",1997,2h 18m,,3.1,1611841,Darren Aronofsky,South Korea,Hin,77695144,126059277,20160904,G,,Marvel Studios
NF3675,The Irishman,Horror,2014,195 min,6.3,6.4,467286,J.J. Abrams,U.S.,english,116516837,,2024-05-09,G,"Brad Pitt, Viola Davis",Focus Features
NF1647,His House (Extended Collector's Edition with Bonus Features and Director's Commentary),Animation | Thriller,2000,111 min,4.3,6.3,"1,954,691",Wong Kar-wai,France,Kor,"$130,609,026",394793313,"May 24, 2024",NC-17,,Pixar Animation Studios
NF7734,,Comedy,2015,90 min,7.7,9.4,1263900,Martin Scorsese,South Korea,French,"$152,722,346",1159784948,20231113,PG,"Al Pacino, Tom Hanks, Oscar Isaac, Leonardo DiCaprio",Marvel Studios
NF9119,  Project Power  ,Documentary | Thriller,1999,157 min,4.5,,1616782,James Gunn,France,Spa,157683974,,13/11/2021,G,"Florence Pugh, Lupita Nyong'o",Netflix Originals
NF2205,Thunder Force,"Sci-Fi, Drama",1991,162 min,9.0,6.4,1112939,Steven Spielberg,Germany,hindi,9280460,1105575353,05/10/2023,NR,"Natalie Portman, Pedro Pascal, Sandra Bullock, Meryl Streep",Warner Bros.
NF5331,Whiplash,Action,2000,78,6.2,,"1,655,751",Rian Johnson,France,FRENCH,"$223,380,990",267695647,"July 16, 2024",PG-13,"Zendaya, Tom Hanks, Charlize Theron, Florence Pugh",Paramount Pictures
NF5876,Eternals, Drama,2002,185 min,8.3,8.3,746848,Paul Thomas Anderson,France,Ger,104785370,"794,314,107",20190622,G,"Dwayne Johnson, Chris Evans",Blumhouse Productions
NF2507,Passing,"Horror,",2013,174mins,5.4,6.7,436891,Darren Aronofsky,India,korean,$194995874,,20211114,NR,"Zendaya, Viola Davis, Sandra Bullock, Margot Robbie",HBO Films
NF4626,Halloween Kills, Thriller,2003,82 min,5.7,4.0,1957591,,South Korea,Ger,"$65,388,237","96,355,335",2020-02-13,R,"Natalie Portman, Angelina Jolie",Lionsgate
NF7934,Mulan,Horror,2003,104mins,8.2,4.4,"1,221,255",Kathryn Bigelow,France,Spa,"$137,145,447",1201746550,2018-12-02,PG,"Lupita Nyong'o, Dwayne Johnson, Jodie Foster",Amazon Studios
NF6178,Titane,Sci-Fi/Comedy,2023,149 min,4.9,6.6,1852783,Steven Spielberg,United States,french,45479526,1160587356,20230803,PG-13,"Jodie Foster, Tom Hanks",DC Films
NF1803,Hubie Halloween,Horror  ,2006,80 min,7.1,5.0,1017899,Jane Campion,Germany,GERMAN,175361123,"1,612,734,984",20151227,TV-PG,"Morgan Freeman, Angelina Jolie",Pixar Animation Studios
NF6534,In the Heights,Fantasy/Comedy,1998,199mins,7.7,-1.0,187407,Tim Burton,Japan,japanese,91499050,1439867176,"December 9, 2022",PG-13,"Tom Hanks, Dwayne Johnson, Robert De Niro, Brad Pitt",Focus Features
NF5928,Fear Street Part Three 1666,"Romance, Drama",1993,137mins,6.1,9.0,942467,Jordan Peele,South Korea,Ita,1071491,,20200603,PG-13,"Pedro Pascal, Florence Pugh, Robert Downey Jr.",Focus Features
NF2590,Luca,crime,1992,84mins,4.4,5.6,1475608,Sam Raimi,France,hindi,-500000,794616191,20240824,G,"Angelina Jolie, Julia Roberts, Cate Blanchett, Natalie Portman",Netflix Originals
NF5480,Those Who Wish Me Dead,Documentary/Comedy,2014,163,4.4,9.6,851212,David Lynch,South Korea,Ita,2271052,298532162,2022-03-08,NC-17,"Morgan Freeman, Julia Roberts",Focus Features
NF7749,,Crime,2001,77,4.5,-1.0,1095750,Zack Snyder,India,korean,"$173,152,445",1224669855,2021-01-05,PG,"Ana de Armas, Viola Davis, Robert De Niro",Legendary Pictures
NF7675,Schindler's List,"Crime,",2013,129mins,6.1,5.0,"1,019,655",James Gunn,United States,Jap,,111412194,02/04/2021,R,"Leonardo DiCaprio, Lupita Nyong'o, Meryl Streep",DreamWorks Animation
NF6507,Outside the Wire,Action | Thriller,1995,172,4.7,-1.0,1023218,Jordan Peele,Germany,german,,694621200,"February 4, 2024",TV-14,"Viola Davis, Sandra Bullock, Natalie Portman",Warner Bros.
NF4755,Ford v Ferrari,Adventure ,2010,140mins,,6.9,1964677,David Fincher,Japan,Hindi,,1445851346,14/06/2020,PG,"Michael B. Jordan, Will Smith, Natalie Portman, Adam Driver",Blumhouse Productions
NF2258,Crip Camp,Documentary | Thriller,2011,1000,8.8,,1784388,James Cameron,South Korea,Jap,38523094,1211969744,2020-10-25,G,"Ryan Reynolds, Brad Pitt",
NF6646,Home Sweet Home Alone!!!,Thriller,2003,100mins,,3.3,1045477,,France,hindi,175307387,298370066,"December 26, 2019",TV-MA,"Pedro Pascal, Ryan Reynolds",A24
NF3871,The Suicide Squad,Fantasy ,2099,176 min,,,1334550,Kathryn Bigelow,France,JAPANESE,57394999,"919,280,146",12/12/2020,PG,"Denzel Washington, Scarlett Johansson",Pixar Animation Studios
NF3564,The Power of the Dog,Adventure | Thriller,2023,185mins,,8.9,72569,Kathryn Bigelow,France,ENGLISH,240539287,101022871,"May 7, 2022",TV-14,"Robert Downey Jr., Pedro Pascal, Oscar Isaac",20th Century Studios
NF5883,Jungle Cruise,Animation,2003,85mins,,,1197522,Francis Ford Coppola,Japan,Kor,$136392936,"1,599,685,835",09/12/2019,NR,"Florence Pugh, Lupita Nyong'o, Chris Evans",20th Century Studios
NF4330,The Lord of the Rings: The Return of the King,"Fantasy, Drama",2010,93mins,8.7,7.6,1407826,Patty Jenkins,Italy,KOREAN,185903695,4867100,24/04/2020,TV-PG,"Florence Pugh, Will Smith",
NF9372,Gladiator, Crime,2004,75mins,5.7,8.1,125767,Coen Brothers,India,german,$172846004,,20240824,PG-13,"Natalie Portman, Meryl Streep, Zendaya",HBO Films
NF1276,Call Me By Your Name, Thriller,2015,192mins,4.4,4.4,1705975,David Lynch,Germany,ITALIAN,209935599,1866200881,09/09/2018,NR,"Angelina Jolie, Denzel Washington, Viola Davis, Zendaya",Focus Features
NF2666,The Addams Family 2,"Comedy,",2002,156 min,5.4,5.9,1604037,Zack Snyder,Japan,Kor,109067001,1098354305,25/03/2019,PG,,Universal Pictures
NF6570,Collective,Drama,2020,127 min,5.0,9.7,1988275,Alfred Hitchcock,United States,Hin,$165784999,367898969,"September 12, 2018",TV-MA,"Julia Roberts, Tom Hanks, Cate Blanchett, Leonardo DiCaprio",Walt Disney Pictures
NF2219,, Animation,2009,2h 8m,9.1,7.8,868418,Greta Gerwig,Britain,english,229785265,1433675423,20151102,R,"Florence Pugh, Lupita Nyong'o, Morgan Freeman",Warner Bros.
NF9680,Spiral,Romance  ,2011,164 min,4.3,4.5,426245,Peter Jackson,South Korea,Jap,,934700298,"May 9, 2024",PG,"Dwayne Johnson, Leonardo DiCaprio, Denzel Washington",
NF4542,The Old Guard,Sci-Fi ,2021,145 min,7.8,7.2,510559,Chloé Zhao,usa,italian,"$228,916,562",1961470277,"December 5, 2023",NR,"Margot Robbie, Viola Davis, Natalie Portman",Walt Disney Pictures
NF6094,Leon The Professional,Crime | Thriller,2022,109 min,5.9,6.6,1439919,Paul Thomas Anderson,Italy,hindi,63403048,,23/10/2015,TV-MA,,Netflix Originals
NF6688,The Umbrella Academy,Fantasy,1993,103mins,8.7,4.3,"127,215",Tim Burton,South Korea,HINDI,,1962272683,20/07/2015,TV-PG,"Ana de Armas, Will Smith, Oscar Isaac, Angelina Jolie",Pixar Animation Studios
NF3344,The Suicide Squad,Horror/Comedy,2018,180 min,7.7,5.0,819110,Sam Raimi,South Korea,German,-500000,613616924,20220317,TV-14,"Pedro Pascal, Ryan Reynolds",Marvel Studios
NF7662,A Beautiful Mind,"Comedy,",2024,162 min,7.7,8.9,461121,Kathryn Bigelow,Italy,Jap,$167123150,1327854209,"January 6, 2024",NC-17,"Al Pacino, Scarlett Johansson, Angelina Jolie",20th Century Studios
NF3167,Zack Snyder's Justice League,Action,2009,2h 20m,5.9,6.2,1728805,Tim Burton,UK,KOREAN,$29519088,722263647,20191111,NC-17,"Dwayne Johnson, Sandra Bullock, Morgan Freeman, Chris Evans",Focus Features
NF6989,Licorice Pizza,fantasy,2003,105mins,4.6,9.4,1474069,Park Chan-wook,Germany,KOREAN,135674960,595265084,12/02/2015,TV-PG,"Robert De Niro, Pedro Pascal, Ryan Reynolds, Adam Driver",Paramount Pictures
NF9435,Alex Rider, Fantasy,2099,156mins,8.5,6.5,1479970,Jordan Peele,Germany,HINDI,"$124,325,722","333,430,434","February 2, 2015",PG,"Angelina Jolie, Adam Driver",Paramount Pictures
NF2280,Bad Boys for Life,Animation/Comedy,1993,1000,8.1,5.7,1829744,Alfonso Cuaron,United Kingdom,Hin,147050086,238201114,"August 9, 2024",G,"Zendaya, Robert Downey Jr., Sandra Bullock",Universal Pictures
NF6397,Thunder Force,Romance | Thriller,2015,102mins,4.3,15.0,1217558,Billy Wilder,France,german,"$149,524,752",493999485,"September 2, 2020",TV-MA,"Jodie Foster, Tom Hanks, Charlize Theron, Oscar Isaac",Lionsgate
NF1834,Clifford the Big Red Dog,romance,2005,100 min,5.5,,825584,Park Chan-wook,US,Italian,$165730142,640803137,01/02/2020,PG-13,"Viola Davis, Leonardo DiCaprio, Angelina Jolie",Netflix Originals
NF1979,The Unforgivable,FANTASY,1997,72mins,4.2,8.7,42952,Alfred Hitchcock,South Korea,Jap,,489497815,20180809,NR,"Will Smith, Tom Hanks",Legendary Pictures
NF3361,,Fantasy  ,2001,,7.4,,1102867,Paul Thomas Anderson,Japan,German,40579906,963570281,20170105,G,"Charlize Theron, Chris Evans, Timothée Chalamet, Zendaya",Paramount Pictures
NF5819,Eternals,Romance,2010,77,5.1,5.0,697269,Martin Scorsese,Japan,KOREAN,161919469,1661371878,28/06/2018,NR,"Denzel Washington, Al Pacino",Legendary Pictures
NF3241,Ascension,Romance  ,2004,1h 29m,5.7,6.5,1482387,Wes Anderson,US,FRENCH,"$150,332,695",1884674807,2015-11-21,PG-13,"Michael B. Jordan, Scarlett Johansson, Sandra Bullock, Robert Downey Jr.",Lionsgate
NF9161,Pulp Fiction,Sci-Fi/Comedy,1999,147mins,4.4,8.2,423581,Alfred Hitchcock,Italy,HINDI,145597145,1640702147,04/07/2015,TV-MA,,Pixar Animation Studios
NF6221,The Harder They Fall ,ROMANCE,2000,89,4.5,7.2,65097,Paul Thomas Anderson,France,japanese,,408088084,"December 18, 2021",NR,"Ryan Reynolds, Dwayne Johnson, Chris Evans",Marvel Studios
NF1529,The Lovebirds,"Documentary, Drama",1994,176mins,7.0,7.1,1499069,Martin Scorsese,U.S.,Japanese,$192867457,1351443154,2022-07-26,PG-13,"Robert De Niro, Jodie Foster, Lupita Nyong'o",A24
NF6314,Three Billboards Outside Ebbing Missouri,Animation  ,2009,2h 10m,4.3,7.8,848590,Guillermo del Toro,Germany,Korean,23837676,0,27/03/2020,NR,"Florence Pugh, Julia Roberts, Ana de Armas, Adam Driver",Pixar Animation Studios
NF4406,Call Me By Your Name,Horror ,2007,,4.9,9.2,1838076,Patty Jenkins,Japan,KOREAN,224149518,951308285,2017-06-11,TV-MA,"Robert De Niro, Charlize Theron, Denzel Washington",Legendary Pictures
NF9495,The One and Only Ivan,action,2000,177mins,9.0,7.8,1215588,Wes Anderson,India,Ita,,1757758596,20151114,NC-17,"Morgan Freeman, Robert Downey Jr., Charlize Theron",Legendary Pictures
NF3246,The Social Network,Drama,1995,1000,5.5,3.2,472561,Coen Brothers,Japan,Kor,39701229,887149967,20180901,NR,"Michael B. Jordan, Sandra Bullock",Marvel Studios
NF8853,Mad Max Fury Road,ACTION,1993,183mins,6.4,3.2,265353,Alfred Hitchcock,Britain,KOREAN,43073445,1469942378,"April 23, 2015",NC-17,"Chris Evans, Denzel Washington",Focus Features
NF3985,, Sci-Fi,2019,185mins,9.3,4.3,"1,566,734",Sam Raimi,U.K.,English,$4071426,"1,024,707,120",20221213,TV-PG,"Lupita Nyong'o, Timothée Chalamet, Dwayne Johnson",
NF7590,My Hero Academia World Heroes Mission,"Thriller,",2016,187mins,6.1,5.2,1516986,Ryan Coogler,Germany,german,196271802,1329126638,20200818,TV-14,"Dwayne Johnson, Will Smith, Timothée Chalamet",Walt Disney Pictures
NF9670,The Dark Knight,Animation ,2099,94,9.3,4.6,145200,Quentin Tarantino,South Korea,Fre,147655304,"1,540,864,648",2016-08-19,TV-14,"Oscar Isaac, Tom Hanks, Robert Downey Jr.",Universal Pictures
NF3582,Spencer (Extended Collector's Edition with Bonus Features and Director's Commentary),"Action,",2014,N/A,4.2,,841539,Wes Anderson,Italy,Hin,193509181,,13/11/2015,TV-MA,"Florence Pugh, Timothée Chalamet, Sandra Bullock",Paramount Pictures
NF7881,Malcolm & Marie,Sci-Fi  ,1890,150mins,5.3,7.9,1168419,Rian Johnson,Germany,german,224460027,1612053407,2024-09-13,TV-MA,"Robert Downey Jr., Florence Pugh, Zendaya, Julia Roberts",DC Films
NF6446,My Hero Academia World Heroes Mission,drama,2003,195,6.2,6.6,1595155,Wong Kar-wai,Italy,Hin,$91195879,78504010,"December 19, 2020",G,"Will Smith, Oscar Isaac, Natalie Portman",Amazon Studios
NF2030,Get Out,ANIMATION,1999,,5.1,-1.0,818572,,South Korea,Hin,121998236,"777,415,057",2015-06-25,TV-MA,"Scarlett Johansson, Charlize Theron, Sandra Bullock, Brad Pitt",Walt Disney Pictures
NF3732,Tom and Jerry,Adventure | Thriller,2000,112mins,8.2,15.0,514886,Darren Aronofsky,Japan,Kor,80500758,1786383644,"August 14, 2021",NR,"Timothée Chalamet, Margot Robbie",Pixar Animation Studios
NF2917,THE CONJURING THE DEVIL MADE ME DO IT,Romance ,1997,185mins,4.0,3.7,"1,480,694",Wong Kar-wai,India,english,125606317,0,11/08/2021,TV-PG,"Denzel Washington, Ryan Reynolds, Brad Pitt",Blumhouse Productions
NF6289,Titane,"Drama,",1994,144,8.7,5.8,438511,Tim Burton,U.K.,Hin,85456751,"1,235,209,504","June 5, 2024",TV-PG,"Oscar Isaac, Julia Roberts, Scarlett Johansson, Ryan Reynolds",Warner Bros.
NF9850,  The Usual Suspects  , Crime,1991,93,4.9,5.0,122761,Greta Gerwig,Japan,Hin,27770434,1022918664,27/06/2022,PG,"Julia Roberts, Robert Downey Jr., Denzel Washington, Michael B. Jordan",Pixar Animation Studios
NF5796,Lady Bird,adventure,1890,129mins,6.3,7.6,1638879,Taika Waititi,usa,korean,75817560,1251152461,"March 26, 2015",TV-PG,"Ryan Reynolds, Cate Blanchett, Ana de Armas",Universal Pictures
NF9383,PULP FICTION,Fantasy,2099,113mins,8.1,-1.0,375210,Quentin Tarantino,India,ITALIAN,32055654,435720723,25/10/2015,TV-PG,"Oscar Isaac, Leonardo DiCaprio, Chris Evans",Lionsgate
NF5625,Ron's Gone Wrong,Crime | Thriller,1890,122mins,5.9,4.4,,Jordan Peele,Japan,SPANISH,10074376,1790107905,20240513,TV-PG,"Meryl Streep, Lupita Nyong'o",A24
NF9138,Saving Private Ryan (Extended Collector's Edition with Bonus Features and Director's Commentary),Drama | Thriller,2003,1h 10m,7.4,3.3,1286447,Spike Lee,Germany,Kor,48835650,1805472010,22/05/2018,TV-14,"Viola Davis, Pedro Pascal, Ryan Reynolds, Angelina Jolie",HBO Films
NF2880,Time (Extended Collector's Edition with Bonus Features and Director's Commentary),"Comedy, Drama",2008,140,7.2,4.3,"294,823",Jane Campion,South Korea,HINDI,$4476379,"1,716,464,983",2019-12-18,NR,"Timothée Chalamet, Sandra Bullock, Cate Blanchett, Chris Evans",Amazon Studios
NF5422,1917,Sci-Fi,2010,91mins,5.9,8.7,175129,David Fincher,USA,HINDI,,1602895885,2018-02-23,TV-MA,"Zendaya, Denzel Washington, Morgan Freeman, Pedro Pascal",Netflix Originals
NF6080,Halloween Kills,Drama/Comedy,2020,1h 38m,8.2,9.5,822879,Paul Thomas Anderson,France,SPANISH,5184044,924770550,2016-12-14,PG,"Lupita Nyong'o, Florence Pugh, Chris Evans, Natalie Portman",Warner Bros.
NF6642,The Kissing Booth 3,Animation | Thriller,1992,111mins,8.5,9.1,,Chloé Zhao,US,SPANISH,$245896714,,"November 25, 2021",NC-17,"Scarlett Johansson, Lupita Nyong'o, Will Smith",HBO Films
NF1549,Time, Fantasy,2016,200mins,8.0,5.4,567868,Tim Burton,UK,Jap,41097157,622219360,"September 15, 2016",TV-PG,,20th Century Studios
NF7945,Parasite, Adventure,2009,192 min,,5.8,1219620,Patty Jenkins,United States,Ger,193001889,"1,426,074,290",20240501,TV-PG,"Will Smith, Viola Davis, Sandra Bullock",Walt Disney Pictures
NF2746,Raya and the Last Dragon,"Horror, Drama",2019,1000,,9.5,991090,Peter Jackson,India,japanese,185141499,61179996,20160516,PG,"Lupita Nyong'o, Pedro Pascal, Florence Pugh, Robert Downey Jr.",Lionsgate
NF2038,Marriage Story,Thriller,2000,N/A,6.7,8.5,502805,James Gunn,India,Hindi,182813400,1034824845,2021-06-09,NC-17,"Viola Davis, Tom Hanks",Warner Bros.
NF3722,To All the Boys Always and Forever,Sci-Fi,2007,2h 18m,8.6,7.4,"1,005,451",Ryan Coogler,South Korea,Fre,194655180,,24/08/2018,PG-13,"Ryan Reynolds, Leonardo DiCaprio, Scarlett Johansson, Tom Hanks",Lionsgate
NF2431,Three Billboards Outside Ebbing Missouri,"Crime, Drama",2013,89mins,8.8,5.3,"362,190",Chloé Zhao,India,HINDI,5840238,1341015275,2022-07-23,R,"Zendaya, Brad Pitt, Timothée Chalamet",Marvel Studios
NF9087,A Castle for Christmas ,Action  ,1997,,7.2,6.6,1851046,Tim Burton,Japan,Jap,-500000,1888871284,2019-08-07,R,"Ryan Reynolds, Leonardo DiCaprio, Angelina Jolie",Focus Features
NF5992,Once Upon a Time in Hollywood, Sci-Fi,1992,1h 34m,5.2,7.1,739990,Steven Spielberg,India,german,$87213413,"1,156,434,033",2016-05-01,TV-PG,"Natalie Portman, Ryan Reynolds, Cate Blanchett",20th Century Studios
NF1229,The Addams Family 2,Adventure,2000,1000,7.6,7.3,1762826,Paul Thomas Anderson,Britain,korean,176877704,"262,219,298",09/02/2022,TV-MA,"Robert Downey Jr., Cate Blanchett, Jodie Foster",Pixar Animation Studios
NF5140,THE ADDAMS FAMILY 2,Fantasy  ,2009,177mins,5.5,3.9,220121,Patty Jenkins,Britain,French,163977678,"564,875,129","April 12, 2023",NC-17,"Meryl Streep, Oscar Isaac",Lionsgate
NF5094,Avengers Endgame,"Crime,",2099,2h 20m,8.3,7.1,"1,192,207",Wes Anderson,France,Ita,,,"June 16, 2015",NR,"Zendaya, Denzel Washington",Paramount Pictures
NF6485,A Hero,Action,1990,146mins,7.3,6.2,1320358,Guillermo del Toro,US,French,71420766,844139496,25/10/2021,NC-17,"Morgan Freeman, Brad Pitt, Ana de Armas",20th Century Studios
NF3742,He's All That!!!,"Animation,",2000,105mins,9.3,5.1,362120,Alfonso Cuaron,Italy,Italian,208363329,303633527,"April 15, 2017",NR,"Pedro Pascal, Denzel Washington, Charlize Theron, Ryan Reynolds",DreamWorks Animation
NF1929,Shang-Chi and the Legend of the Ten Rings,fantasy,2006,175mins,7.4,7.9,1716632,Alfonso Cuaron,South Korea,Japanese,56776062,,2022-12-23,NC-17,"Leonardo DiCaprio, Meryl Streep, Morgan Freeman, Zendaya",Blumhouse Productions
NF3425,Dunkirk, Fantasy,2016,2h 0m,6.7,,1693834,Paul Thomas Anderson,Germany,KOREAN,$52917938,1987050388,"January 14, 2020",NR,"Charlize Theron, Al Pacino, Robert Downey Jr., Zendaya",Universal Pictures
NF3577,Summer of Soul,Romance/Comedy,2020,180 min,4.6,3.2,1691004,Ryan Coogler,Japan,Italian,,1594587184,06/01/2021,PG-13,"Lupita Nyong'o, Adam Driver",HBO Films
NF1530,Drive My Car,Fantasy | Thriller,1998,1h 42m,7.8,,947586,Coen Brothers,South Korea,english,142488158,"1,514,912,231","November 9, 2018",NC-17,"Ana de Armas, Charlize Theron",New Line Cinema
NF9072,The Trial of the Chicago 7,Fantasy,2018,163mins,7.1,5.1,1205057,Jordan Peele,India,korean,180853417,393572048,17/03/2020,R,"Ana de Armas, Sandra Bullock, Chris Evans",DreamWorks Animation
NF9635,Emily in Paris,drama,2021,,9.0,5.2,1934401,Ryan Coogler,France,JAPANESE,"$108,735,022",1554668217,"June 26, 2019",NC-17,"Michael B. Jordan, Will Smith, Adam Driver, Cate Blanchett",Legendary Pictures
NF4020,Drive My Car, Drama,2011,177,8.8,6.5,"1,280,152",Wong Kar-wai,South Korea,Hin,44411721,"1,156,958,026",25/11/2018,TV-14,"Zendaya, Pedro Pascal, Brad Pitt, Viola Davis",
NF5336,The Starling,Sci-Fi/Comedy,2021,144mins,5.3,5.8,1444227,Quentin Tarantino,Japan,Ita,"$163,349,124","1,850,125,105",28/12/2020,TV-14,"Lupita Nyong'o, Angelina Jolie",Legendary Pictures
NF5060,A Castle for Christmas,Thriller,2013,102 min,5.7,8.9,918104,Akira Kurosawa,South Korea,GERMAN,85315650,257624334,20160704,TV-MA,"Dwayne Johnson, Margot Robbie, Morgan Freeman, Zendaya",Paramount Pictures
NF8300,  A Hero  ,"Fantasy, Drama",2016,183 min,9.3,9.1,"1,231,505",Sam Raimi,Germany,Hin,141509425,142082551,2024-07-03,NC-17,"Julia Roberts, Ana de Armas, Al Pacino",Marvel Studios
NF2608,Murder Mystery (Extended Collector's Edition with Bonus Features and Director's Commentary),"Horror,",2014,132,9.3,6.6,1106226,David Lynch,U.S.,Eng,$107943904,1151801548,2017-07-16,G,"Pedro Pascal, Morgan Freeman",20th Century Studios
NF6990,Halloween Kills,Animation,2007,83 min,7.6,5.0,640881,David Fincher,France,KOREAN,35825007,1096802199,"August 25, 2015",PG,"Viola Davis, Tom Hanks",Amazon Studios
NF8161,Spotlight (Extended Collector's Edition with Bonus Features and Director's Commentary),"Comedy, Drama",1992,123 min,5.0,5.2,1949148,,Italy,German,196950685,1584524067,26/04/2023,TV-PG,"Ana de Armas, Pedro Pascal, Oscar Isaac",
NF9043,Extraction,sci-fi,2020,,7.5,6.2,"1,646,105",Jordan Peele,India,Fre,"$238,197,634",400783812,09/01/2022,NC-17,"Margot Robbie, Denzel Washington",Walt Disney Pictures
NF9718,Once Upon a Time in Hollywood,Sci-Fi  ,2005,N/A,4.2,5.5,798987,Tim Burton,Italy,English,45575591,"1,163,542,416",20171211,NC-17,"Julia Roberts, Timothée Chalamet, Ana de Armas",Netflix Originals
NF9613,Three Billboards Outside Ebbing Missouri,Documentary,2015,114,6.9,3.1,795818,Zack Snyder,South Korea,hindi,64156557,"1,316,687,967",06/06/2020,R,"Lupita Nyong'o, Timothée Chalamet, Margot Robbie",New Line Cinema
NF6507,Mortal Kombat,"Horror, Drama",2099,150mins,9.0,6.1,506085,Akira Kurosawa,Italy,Spa,,1393172998,10/05/2017,TV-MA,"Sandra Bullock, Cate Blanchett, Angelina Jolie",Paramount Pictures
NF6748,Kate,Comedy,2005,N/A,4.1,8.5,227326,Tim Burton,France,Hindi,57227768,704705500,"January 13, 2023",R,"Margot Robbie, Meryl Streep",Paramount Pictures
NF5187,PARASITE,Sci-Fi  ,2010,1000,,5.2,680033,Stanley Kubrick,UK,german,157810982,"1,092,355,868",04/07/2023,TV-MA,,Amazon Studios
NF8337,Call Me By Your Name,sci-fi,2009,3h 10m,6.8,5.8,225,Francis Ford Coppola,Japan,Jap,40030134,34079013,05/12/2020,TV-MA,"Lupita Nyong'o, Tom Hanks, Cate Blanchett, Margot Robbie",Amazon Studios
NF6591,Cherry!!!,thriller,1990,149 min,6.1,3.6,94208,J.J. Abrams,Italy,English,$83340486,,"May 13, 2020",TV-MA,"Viola Davis, Al Pacino, Angelina Jolie",DreamWorks Animation
NF3322,THE DEVIL ALL THE TIME,Adventure ,2000,108,5.8,9.3,88267,Denis Villeneuve,South Korea,japanese,124858724,1744638454,2017-11-14,NC-17,"Julia Roberts, Meryl Streep, Florence Pugh, Michael B. Jordan",Apple TV+
NF6431,Goodfellas, Horror,2009,N/A,4.9,,1696477,,Italy,french,229058094,541375357,09/10/2017,NC-17,"Robert De Niro, Julia Roberts",Columbia Pictures
NF1831,Don't Look Up,Adventure,2099,2h 55m,7.7,-1.0,1948563,Alfonso Cuaron,Italy,italian,77606753,1387155219,"February 21, 2015",NR,"Meryl Streep, Julia Roberts, Zendaya, Timothée Chalamet",20th Century Studios
NF7913,Army of the Dead (Extended Collector's Edition with Bonus Features and Director's Commentary),crime,2020,2h 53m,4.7,4.4,,Zack Snyder,South Korea,hindi,122726521,"590,167,703","December 24, 2019",TV-14,"Michael B. Jordan, Florence Pugh, Adam Driver, Robert Downey Jr.",DC Films
NF9438,The Silence of the Lambs (Extended Collector's Edition with Bonus Features and Director's Commentary),sci-fi,2005,,8.9,7.5,774746,Stanley Kubrick,France,hindi,51264519,1728652233,2015-02-12,R,"Zendaya, Tom Hanks, Adam Driver",New Line Cinema
NF5338,Da 5 Bloods,THRILLER,1997,147mins,5.2,6.1,1379576,Chloé Zhao,USA,Fre,221140962,358755976,03/02/2017,NR,"Brad Pitt, Margot Robbie, Natalie Portman",Blumhouse Productions
NF1767,Project Power,adventure,2001,1h 58m,7.3,,176328,Alfonso Cuaron,Italy,hindi,114175575,1083906456,20170824,TV-PG,"Denzel Washington, Margot Robbie, Meryl Streep, Viola Davis",Walt Disney Pictures
NF1010,Red Notice,Thriller  ,2012,115mins,4.9,,1678027,Darren Aronofsky,usa,Korean,245293007,,2024-10-09,PG,"Chris Evans, Ryan Reynolds, Al Pacino",Warner Bros.
NF6993,The Green Mile,"Romance, Drama",2008,160mins,5.9,9.6,,Sofia Coppola,Germany,japanese,170028067,,17/05/2016,NC-17,"Scarlett Johansson, Viola Davis",A24
NF9711,,"Fantasy,",1998,1h 24m,8.3,,117363,David Lynch,India,italian,96845669,1770817521,20221015,NR,"Morgan Freeman, Margot Robbie, Charlize Theron, Natalie Portman",Walt Disney Pictures
NF8671,Passing,romance,2012,181 min,7.5,7.9,1304848,Chloé Zhao,India,ENGLISH,-500000,520555056,2016-07-10,PG,"Brad Pitt, Sandra Bullock, Florence Pugh, Lupita Nyong'o",Universal Pictures
NF1378,He's All That,Documentary/Comedy,2019,70mins,9.2,,907219,Rian Johnson,Italy,ITALIAN,12167458,482313611,"May 14, 2015",TV-MA,"Timothée Chalamet, Sandra Bullock",New Line Cinema
NF2857,Otherhood, Adventure,1993,N/A,,4.9,754316,Ridley Scott,India,Ita,172968356,1129575395,10/09/2023,NR,"Oscar Isaac, Viola Davis, Ana de Armas, Pedro Pascal",HBO Films
NF7636,Little Women!!!,"Adventure,",2002,185,7.9,8.1,131305,J.J. Abrams,France,KOREAN,"$31,089,554","1,852,597,879",21/09/2022,TV-14,"Timothée Chalamet, Robert De Niro, Viola Davis, Ana de Armas",HBO Films
NF6921,Last Night in Soho, Crime,2023,,,8.6,"46,375",Christopher Nolan,U.S.,Korean,$156320666,1799387692,20180426,TV-PG,"Morgan Freeman, Michael B. Jordan, Robert Downey Jr.",DreamWorks Animation
NF2103,The Favourite,Adventure  ,1992,142mins,5.2,15.0,1701996,J.J. Abrams,France,italian,,933780228,13/11/2020,PG-13,,20th Century Studios
NF2886,, Comedy,2003,,7.9,6.2,112304,Peter Jackson,UK,Fre,35263056,89974602,2016-10-24,PG-13,"Charlize Theron, Adam Driver, Chris Evans, Sandra Bullock",
NF4460,,Adventure ,2002,131,7.4,6.0,1576307,Jordan Peele,Italy,Japanese,242228705,1969843741,11/09/2015,PG,"Dwayne Johnson, Meryl Streep, Lupita Nyong'o",Focus Features
NF1195,The Little Things,"Documentary, Drama",2003,192mins,9.2,15.0,1553257,James Gunn,Japan,English,217854381,958679286,"June 4, 2016",PG,"Dwayne Johnson, Margot Robbie, Chris Evans",Netflix Originals
NF4039,Three Billboards Outside Ebbing Missouri,Horror ,2010,114mins,5.7,,"761,962",Alfred Hitchcock,U.K.,HINDI,162771656,"1,224,623,275",2024-04-02,PG,"Charlize Theron, Florence Pugh, Adam Driver, Viola Davis",Marvel Studios
NF8108,Night at the Museum Secret of the Tomb,Horror,2022,,5.4,3.2,"1,380,722",Guillermo del Toro,Italy,KOREAN,177212351,72791859,"December 4, 2020",G,"Zendaya, Pedro Pascal",Walt Disney Pictures
NF2850,The Prestige,"Crime,",2014,N/A,7.0,5.5,1112643,Alfonso Cuaron,India,GERMAN,66362693,1497700835,20171222,PG,"Robert De Niro, Zendaya, Pedro Pascal",Warner Bros.
NF4546,C'mon C'mon,Crime ,2008,2h 11m,8.1,4.8,43196,Jane Campion,United Kingdom,Spanish,213677510,,2021-05-21,NR,"Natalie Portman, Robert Downey Jr.",Lionsgate
NF6009,Bird Box,DRAMA,2008,180mins,8.3,-1.0,"1,479,961",David Lynch,Germany,japanese,,574500656,"September 27, 2024",NC-17,,New Line Cinema
NF5536,Rebecca,Animation ,1993,2h 30m,7.6,8.3,962021,Billy Wilder,France,hindi,$86201999,"531,892,282",2023-12-03,TV-MA,"Viola Davis, Meryl Streep, Morgan Freeman",Legendary Pictures
NF4747,THE OLD GUARD,thriller,2015,N/A,9.3,,1930801,Alfred Hitchcock,Japan,HINDI,173273808,1938340685,22/05/2017,NR,"Julia Roberts, Cate Blanchett",Amazon Studios
NF8255,Marriage Story,Animation/Comedy,1992,122,6.2,6.4,1844213,Greta Gerwig,UK,italian,33571975,0,2024-07-06,G,"Jodie Foster, Ryan Reynolds, Sandra Bullock",Netflix Originals
