Movie_ID,Title,Genre,Release_Year,Duration,Rating,IMDb_Rating,Votes,Director,Country,Language,Budget,Revenue,Date_Added,Age_Rating,Cast,Production_House
NF5047,Roma,romance,2023,1h 42m,6.3,3.7,230182,Chloé Zhao,Britain,hindi,144114148,,2018-05-04,TV-MA,"Sandra Bullock, Ryan Reynolds",Lionsgate
NF7216,The Irishman,Action  ,2005,86,6.1,5.6,1518812,Greta Gerwig,U.K.,HINDI,"$98,907,028",558143146,2022-03-06,NR,,Amazon Studios
NF9092,The Unforgivable,documentary,2024,151mins,6.3,,799230,David Lynch,Italy,Spa,-500000,221124183,2015-10-12,G,"Cate Blanchett, Ana de Armas",20th Century Studios
NF9053,No Time to Die,comedy,2006,177 min,8.0,8.0,490549,Paul Thomas Anderson,Germany,German,48071220,683948204,2021-01-11,TV-PG,"Tom Hanks, Oscar Isaac, Florence Pugh, Timothée Chalamet",Walt Disney Pictures
NF4060,Enola Holmes,Drama | Thriller,2013,105mins,6.0,9.6,"1,020,695",Chloé Zhao,United Kingdom,ITALIAN,$50127868,207486776,20231126,NR,"Margot Robbie, Brad Pitt",New Line Cinema
NF5796,Hell or High Water, Romance,2018,N/A,5.1,,1878522,Stanley Kubrick,U.S.A,Jap,83786226,681881260,12/09/2015,G,"Robert Downey Jr., Leonardo DiCaprio",Paramount Pictures
NF8513,Greyhound,Thriller,2011,190mins,4.9,3.2,509033,J.J. Abrams,Japan,GERMAN,77321344,572548567,2017-11-15,NR,"Natalie Portman, Timothée Chalamet",Blumhouse Productions
NF5102,The Mitchells vs the Machines,"Horror,",1999,,5.5,3.1,"1,614,888",Taika Waititi,France,spanish,160611953,620692631,2015-03-13,NR,"Cate Blanchett, Oscar Isaac, Robert Downey Jr.",Columbia Pictures
NF1530,The Lost Daughter,Romance ,1994,105,7.6,3.8,1046671,Ryan Coogler,Britain,Hin,"$164,749,531","1,968,223,462",2022-04-04,PG,"Julia Roberts, Adam Driver, Brad Pitt",A24
NF5987,The Irishman,Adventure,1992,,8.6,4.4,808072,Ridley Scott,France,FRENCH,101042983,1544445240,20170709,PG-13,"Tom Hanks, Robert Downey Jr., Robert De Niro",Legendary Pictures
NF3132,Dunkirk,Action  ,1990,79 min,,8.0,"1,542,790",Akira Kurosawa,South Korea,Japanese,,1283981896,"October 19, 2023",TV-MA,"Brad Pitt, Angelina Jolie",A24
NF2812,The Matrix, Adventure,2001,184mins,4.4,8.9,314721,David Lynch,Germany,HINDI,40402711,559731813,"August 8, 2017",TV-14,"Timothée Chalamet, Florence Pugh, Margot Robbie, Cate Blanchett",Universal Pictures
NF5167,Outside the Wire,Fantasy | Thriller,2001,1h 11m,6.7,7.3,415911,Park Chan-wook,France,JAPANESE,-500000,122849728,"June 15, 2017",NC-17,"Margot Robbie, Denzel Washington, Charlize Theron",Blumhouse Productions
NF3378,A Castle for Christmas,"Horror, Drama",2010,,5.9,7.2,571763,Sofia Coppola,Britain,Jap,201582560,"1,442,972,468",17/04/2024,PG-13,"Leonardo DiCaprio, Cate Blanchett, Zendaya",Walt Disney Pictures
NF6734,Call Me By Your Name ,Comedy ,1890,,,8.2,"1,007,986",Alfonso Cuaron,Japan,german,"$46,845,937",,"February 9, 2021",NR,"Morgan Freeman, Lupita Nyong'o, Meryl Streep",Focus Features
NF3921,  Gladiator  ,FANTASY,2011,160,6.4,,1869014,Alfonso Cuaron,India,KOREAN,113711529,"1,048,479,398","January 21, 2021",TV-MA,"Denzel Washington, Brad Pitt",Universal Pictures
NF4626,,"Sci-Fi, Drama",1999,145mins,4.5,5.3,880080,Rian Johnson,Germany,english,60975229,1111375649,2020-08-09,PG,"Natalie Portman, Tom Hanks, Leonardo DiCaprio, Dwayne Johnson",Columbia Pictures
NF6322,Ascension,"Romance,",2022,1000,9.4,,1797249,Zack Snyder,Japan,Spanish,54152388,1427373088,2016-12-04,PG-13,"Brad Pitt, Ana de Armas, Oscar Isaac, Tom Hanks",Netflix Originals
NF8292,Kate, Thriller,1991,2h 0m,6.9,8.9,"1,456,609",Coen Brothers,Germany,Fre,$174890511,1584110282,2017-01-17,R,"Chris Evans, Denzel Washington",Focus Features
NF2702,The Hand of God,Romance,1996,167mins,5.7,,,Spike Lee,India,Kor,59783667,316856691,2016-07-12,PG-13,"Margot Robbie, Morgan Freeman, Will Smith, Sandra Bullock",Apple TV+
NF3802,Da 5 Bloods,"Fantasy, Drama",2007,1000,6.6,4.6,962214,Patty Jenkins,Italy,english,$14944030,1701725508,2018-11-12,R,"Angelina Jolie, Viola Davis",20th Century Studios
NF3957,Joker,"Animation,",2003,1000,5.3,4.5,1359413,David Lynch,Japan,Jap,213112922,760783519,2015-09-21,G,"Denzel Washington, Will Smith, Meryl Streep",Focus Features
NF7459,Flee,"Sci-Fi,",2003,114,6.1,8.7,"1,830,359",Coen Brothers,UK,Spa,36947024,,"August 26, 2021",TV-14,"Julia Roberts, Ana de Armas, Florence Pugh, Adam Driver",Amazon Studios
NF3975,Room,ACTION,1994,153mins,7.6,4.1,488692,Park Chan-wook,United States,Italian,101193883,,02/07/2018,TV-14,"Will Smith, Michael B. Jordan",Walt Disney Pictures
NF7387,Holidate, Romance,1992,1h 57m,7.7,7.6,1815118,Martin Scorsese,Italy,JAPANESE,75604922,1101716477,20240917,G,"Angelina Jolie, Lupita Nyong'o",DreamWorks Animation
NF9562,The Lost Daughter ,Romance  ,2020,173mins,7.7,9.6,1144445,Darren Aronofsky,Germany,spanish,4237884,463329727,2024-08-08,TV-MA,"Natalie Portman, Morgan Freeman",Amazon Studios
NF7025,Hell or High Water!!!, Sci-Fi,2017,134mins,9.1,8.7,1182939,David Lynch,Italy,german,$230762979,1012389071,11/09/2018,TV-14,"Tom Hanks, Cate Blanchett, Angelina Jolie, Al Pacino",Universal Pictures
NF2388,Night at the Museum Secret of the Tomb, Thriller,2013,106,4.8,4.3,1454334,Guillermo del Toro,Italy,hindi,"$226,518,685",115229300,2020-01-16,TV-14,"Oscar Isaac, Zendaya, Adam Driver, Jodie Foster",Warner Bros.
NF8758,Parasite,Sci-Fi,2010,129mins,7.5,6.2,714719,J.J. Abrams,Germany,SPANISH,154118889,491716347,20241008,R,"Pedro Pascal, Tom Hanks, Natalie Portman",Walt Disney Pictures
NF9771,Fear Street Part Two 1978,Crime,2004,189 min,6.5,7.0,"359,428",Martin Scorsese,U.S.,italian,,1543858984,20191009,G,"Oscar Isaac, Florence Pugh, Al Pacino, Timothée Chalamet",Legendary Pictures
NF6900,,Animation ,2006,164mins,8.4,4.9,372181,Akira Kurosawa,Italy,SPANISH,$53266321,55314104,05/02/2023,NC-17,"Pedro Pascal, Michael B. Jordan",HBO Films
NF8283,,thriller,2099,2h 58m,6.4,6.3,1099122,Alfonso Cuaron,South Korea,hindi,55833282,555488924,"December 16, 2024",PG-13,"Robert De Niro, Pedro Pascal, Sandra Bullock",DC Films
NF3895,Raya and the Last Dragon,Documentary,2019,141mins,,6.9,"1,615,661",Steven Spielberg,India,Hin,208068469,1577457605,2023-09-01,PG-13,"Timothée Chalamet, Al Pacino, Denzel Washington",DC Films
NF9724,Passing,"Animation, Drama",2018,110mins,5.6,5.3,361377,Ridley Scott,Japan,Jap,"$8,295,632",297681189,20241017,TV-14,"Natalie Portman, Chris Evans",Lionsgate
NF5913,The Conjuring The Devil Made Me Do It,Thriller/Comedy,2001,,8.4,4.9,1202602,Guillermo del Toro,usa,Jap,"$186,693,291",288676447,01/07/2021,TV-MA,"Lupita Nyong'o, Florence Pugh",Paramount Pictures
NF5448,Nomadland,Thriller ,2009,125,6.1,,194304,Greta Gerwig,Italy,spanish,$130281011,1124582484,20190605,PG,"Al Pacino, Will Smith, Meryl Streep, Ana de Armas",DreamWorks Animation
NF2329,Army of the Dead (Extended Collector's Edition with Bonus Features and Director's Commentary),"Drama,",2022,1h 24m,6.0,8.7,965848,Steven Spielberg,Japan,Spanish,216370924,776781502,19/05/2015,NC-17,"Meryl Streep, Adam Driver, Florence Pugh",Netflix Originals
NF6184,The Lord of the Rings: The Return of the King,Comedy,2014,1h 23m,8.5,4.0,1777763,Peter Jackson,Germany,Hindi,"$84,503,585",1748369671,20161008,TV-14,"Ryan Reynolds, Sandra Bullock, Florence Pugh, Dwayne Johnson",DC Films
NF3104,Spiral ,ACTION,2003,,4.5,5.1,,Tim Burton,usa,Fre,81572492,338937029,"February 27, 2018",G,"Morgan Freeman, Cate Blanchett, Will Smith, Sandra Bullock",Pixar Animation Studios
NF4343,The Lovebirds,Drama,2008,147mins,7.3,5.7,719305,Paul Thomas Anderson,Japan,korean,$10866806,1691023110,20170211,TV-14,"Al Pacino, Natalie Portman, Florence Pugh",20th Century Studios
NF8476,Spotlight,Romance | Thriller,2013,179mins,4.7,6.1,"1,154,508",Alfred Hitchcock,South Korea,Hin,22771349,1083985939,20170727,NR,"Morgan Freeman, Scarlett Johansson",Netflix Originals
NF2602,The One and Only Ivan,Horror  ,2023,155 min,7.7,5.4,294704,Ryan Coogler,Britain,JAPANESE,118408877,212494519,"December 16, 2020",G,"Charlize Theron, Julia Roberts, Dwayne Johnson, Jodie Foster",New Line Cinema
NF3332,Venom Let There Be Carnage,THRILLER,2017,N/A,8.2,,"1,663,257",Patty Jenkins,Italy,FRENCH,,22159796,2016-02-20,R,"Viola Davis, Tom Hanks",Apple TV+
NF7058,The Green Mile,Fantasy,2023,1h 18m,4.8,4.0,866114,Spike Lee,Italy,spanish,226477834,1379345209,2019-02-02,TV-14,"Dwayne Johnson, Pedro Pascal, Scarlett Johansson",Marvel Studios
NF8448,Green Book ,animation,2019,175mins,8.3,9.4,1064532,Alfred Hitchcock,India,Hin,1616035,890353653,2015-01-01,TV-MA,"Natalie Portman, Charlize Theron, Jodie Foster, Florence Pugh",Marvel Studios
NF4637,Cast Away,thriller,2014,71mins,7.4,4.0,,,India,Ger,115589386,1003623527,2015-08-21,G,"Jodie Foster, Ana de Armas, Natalie Portman, Pedro Pascal",Focus Features
NF9415,Bad Boys for Life, Adventure,2014,88,4.0,8.3,86113,Christopher Nolan,USA,english,36043131,363613248,2021-09-27,G,"Angelina Jolie, Meryl Streep, Robert De Niro",Paramount Pictures
NF1737,Licorice Pizza,Sci-Fi,2008,98 min,6.0,6.1,99347,Jane Campion,France,spanish,96422916,1848278469,2022-03-22,TV-14,"Oscar Isaac, Ana de Armas",Lionsgate
NF6977,American History X,Documentary | Thriller,2018,146,7.7,8.9,513357,Peter Jackson,India,HINDI,194517908,838269490,20160708,TV-MA,"Charlize Theron, Pedro Pascal",Lionsgate
NF8268,Ascension,"Action, Drama",2019,147mins,8.4,4.2,981030,Akira Kurosawa,France,japanese,$21901939,1171366799,2018-12-03,TV-PG,"Adam Driver, Chris Evans, Florence Pugh, Ana de Armas",Apple TV+
NF4089,Malcolm & Marie,Romance,2014,112,4.9,-1.0,246454,James Cameron,France,hindi,179134293,0,"November 18, 2020",NC-17,"Morgan Freeman, Angelina Jolie, Meryl Streep, Oscar Isaac",Focus Features
NF9861,Da 5 Bloods,FANTASY,2005,135mins,4.1,,341725,Martin Scorsese,Japan,Korean,$95766369,915607391,2024-07-20,PG,"Jodie Foster, Will Smith, Sandra Bullock, Brad Pitt",A24
NF2267,Coming 2 America,Crime/Comedy,1991,,6.9,,1001728,David Lynch,Japan,Jap,13819116,460571623,20210903,NR,"Jodie Foster, Robert De Niro, Ryan Reynolds, Meryl Streep",Amazon Studios
NF9012,Army of Thieves,FANTASY,2015,198mins,8.5,-1.0,1662539,Martin Scorsese,South Korea,english,,922798658,01/12/2024,NC-17,"Oscar Isaac, Brad Pitt, Florence Pugh",Columbia Pictures
NF3643,Shang-Chi and the Legend of the Ten Rings,documentary,2013,158mins,5.0,6.6,,Guillermo del Toro,Japan,Italian,175429599,"1,081,696,982",24/02/2019,NR,"Timothée Chalamet, Leonardo DiCaprio, Morgan Freeman",HBO Films
NF9527,Free Guy,"Sci-Fi,",1890,125 min,4.3,8.5,"1,072,257",Park Chan-wook,Britain,Spa,109434439,1111779953,01/09/2015,TV-MA,,20th Century Studios
NF3765,Inception, Comedy,2005,2h 53m,,7.1,,Steven Spielberg,US,Hin,232606816,669608406,"March 15, 2019",R,"Natalie Portman, Robert Downey Jr., Denzel Washington, Ryan Reynolds",Amazon Studios
NF6211,  Venom Let There Be Carnage  ,"Fantasy, Drama",1992,77mins,4.4,3.1,1774071,Kathryn Bigelow,France,HINDI,144851787,948912143,11/10/2021,PG,,DreamWorks Animation
NF2562,THE GODFATHER,Romance,1890,168 min,9.2,7.9,,Darren Aronofsky,U.S.A,Fre,$109328192,1982455058,"December 4, 2019",NC-17,"Scarlett Johansson, Al Pacino, Pedro Pascal",Focus Features
NF8816,Flee, Sci-Fi,2011,80mins,,7.3,1225725,Patty Jenkins,Japan,hindi,,707113690,2020-07-26,NR,"Oscar Isaac, Adam Driver, Michael B. Jordan, Viola Davis",Focus Features
NF3936,Hell or High Water,Animation,2011,,8.8,7.4,1986330,David Lynch,U.K.,spanish,248262851,93637621,20191224,NC-17,"Lupita Nyong'o, Jodie Foster, Michael B. Jordan, Denzel Washington",Columbia Pictures
NF2281,The Father (Extended Collector's Edition with Bonus Features and Director's Commentary),Drama | Thriller,2018,104mins,5.1,3.0,1363109,,Germany,Hindi,108368381,"885,763,360","October 6, 2019",R,"Zendaya, Angelina Jolie, Will Smith, Scarlett Johansson",Lionsgate
NF6192,OUTER BANKS,Animation | Thriller,2024,,,8.2,1945861,Wes Anderson,South Korea,Hin,202943727,1232170604,20171024,TV-PG,"Robert De Niro, Pedro Pascal, Meryl Streep",Pixar Animation Studios
NF7855,Work It,Drama ,2023,163mins,6.7,5.3,1300075,Quentin Tarantino,India,french,149213393,709396832,20200927,PG,"Ana de Armas, Viola Davis, Julia Roberts",Netflix Originals
NF1501,Greyhound,"Adventure,",1992,133mins,5.9,5.2,404233,J.J. Abrams,South Korea,Ger,9349831,599092612,20191007,PG-13,,DC Films
NF4227,  Eurovision Song Contest  ,"Adventure,",2016,2h 6m,,7.6,1360129,Jane Campion,Japan,Eng,159550950,1391703865,2022-07-16,G,"Viola Davis, Al Pacino",Walt Disney Pictures
NF8067,The Starling (Extended Collector's Edition with Bonus Features and Director's Commentary),Drama  ,1998,194 min,6.8,15.0,400127,Martin Scorsese,Germany,Spanish,$36023601,1909568122,20231020,TV-14,"Chris Evans, Leonardo DiCaprio",20th Century Studios
NF5512,Titane,Fantasy,2010,84mins,9.0,6.3,1601834,Alfonso Cuaron,Italy,korean,100115951,633150391,20160628,R,"Meryl Streep, Adam Driver",Marvel Studios
NF1860,Knives Out,Drama,1994,2h 17m,8.5,4.2,"966,244",Peter Jackson,France,Jap,140559877,1241097987,20221116,TV-MA,"Pedro Pascal, Scarlett Johansson, Brad Pitt, Robert Downey Jr.",Paramount Pictures
NF5819,Eternals,fantasy,2010,77,5.4,5.0,697269,Martin Scorsese,Japan,KOREAN,161919469,1661371878,28/06/2018,NR,"Denzel Washington, Al Pacino",Legendary Pictures
NF7607,  Mortal Kombat  ,"Action,",1992,,5.2,3.6,1324379,James Cameron,United States,Kor,96507568,906102898,2019-01-01,PG,"Natalie Portman, Ryan Reynolds, Al Pacino, Timothée Chalamet",Legendary Pictures
NF4003,Cast Away,Fantasy,2021,,4.9,7.9,67102,Peter Jackson,UK,Fre,$132176474,"442,994,746",07/09/2020,NC-17,"Julia Roberts, Robert De Niro, Charlize Theron, Brad Pitt",New Line Cinema
NF5918,The Wrong Missy,drama,1992,1h 49m,7.2,15.0,254949,Sam Raimi,Japan,Eng,-500000,"1,998,718,720",20160919,PG,"Al Pacino, Natalie Portman",Marvel Studios
NF7240,Attica,ANIMATION,2015,N/A,5.1,5.1,119920,Darren Aronofsky,Japan,italian,245090742,1007210680,20161128,TV-MA,"Adam Driver, Sandra Bullock, Jodie Foster",Lionsgate
NF9176,,Horror ,2001,2h 58m,6.4,6.5,1236749,Taika Waititi,Italy,KOREAN,$138132509,"970,588,833",08/02/2019,PG,"Al Pacino, Will Smith, Zendaya, Leonardo DiCaprio",Focus Features
NF7777,LITTLE WOMEN,"Sci-Fi,",2005,165mins,,9.2,1550131,Greta Gerwig,India,Spa,39554299,543921798,2022-08-14,NR,"Denzel Washington, Pedro Pascal",Universal Pictures
NF4058,Fight Club, Action,2020,3h 1m,4.2,15.0,1038492,Billy Wilder,Italy,french,,445933070,20161127,TV-14,"Lupita Nyong'o, Sandra Bullock, Angelina Jolie, Al Pacino",Walt Disney Pictures
NF7989,Lady Bird,Romance,2021,119,8.3,4.0,"1,792,000",Steven Spielberg,USA,SPANISH,14022670,1002357564,"February 17, 2020",TV-14,"Angelina Jolie, Leonardo DiCaprio",DC Films
NF9220,Onward,Animation ,2008,161 min,5.9,5.8,530577,David Lynch,Germany,Korean,154010222,428992992,20230823,R,"Viola Davis, Timothée Chalamet, Florence Pugh",DC Films
NF5382,Murder Mystery,Animation ,2023,3h 5m,4.1,7.5,1469567,James Cameron,Japan,French,,1177852499,25/01/2015,PG,"Robert Downey Jr., Morgan Freeman",Marvel Studios
NF6056,A Quiet Place Part II,Adventure,2009,123,8.8,9.2,,Wes Anderson,France,Kor,"$128,469,660",809709062,20211025,R,"Natalie Portman, Adam Driver",20th Century Studios
NF3962,Joker,"Adventure, Drama",1990,,8.2,6.2,221944,,U.K.,spanish,182189492,1628253565,13/11/2024,TV-PG,"Sandra Bullock, Oscar Isaac",Amazon Studios
NF7812,The Unforgivable,Animation ,2008,179mins,5.4,-1.0,1864156,Kathryn Bigelow,France,french,243567296,1166829631,20220809,TV-MA,"Will Smith, Cate Blanchett",Netflix Originals
NF6004,Demon Slayer Mugen Train,"Animation,",2009,168mins,,5.3,,Kathryn Bigelow,Germany,Hin,70151748,"1,199,113,706",20210216,NR,"Jodie Foster, Natalie Portman",Columbia Pictures
NF1003,Time,Animation | Thriller,2018,120 min,5.6,7.6,1964452,Paul Thomas Anderson,South Korea,French,137515866,274023772,20190112,G,"Viola Davis, Robert De Niro",Warner Bros.
NF2966,No Country for Old Men,Horror/Comedy,2010,190,9.4,6.2,"1,786,746",Paul Thomas Anderson,Italy,italian,218725862,531084922,2021-07-14,TV-PG,"Oscar Isaac, Natalie Portman, Charlize Theron, Leonardo DiCaprio",Universal Pictures
NF7815,Saving Private Ryan,Comedy | Thriller,1890,113 min,5.8,5.8,1162810,Christopher Nolan,U.S.A,French,,"1,092,433","April 15, 2020",NR,,
NF1258,Candyman,Sci-Fi,2017,194mins,8.5,7.8,100926,Sofia Coppola,Japan,Hindi,-500000,1526096177,14/06/2023,PG-13,"Lupita Nyong'o, Meryl Streep, Jodie Foster, Brad Pitt",Blumhouse Productions
NF8029,A Quiet Place Part II,Horror/Comedy,2023,,4.9,5.7,1127311,Quentin Tarantino,Germany,German,22529061,165955608,2018-06-14,PG,"Leonardo DiCaprio, Jodie Foster, Oscar Isaac",Lionsgate
NF4795,Zack Snyder's Justice League,"Adventure, Drama",1998,,7.9,3.0,198810,Chloé Zhao,Japan,GERMAN,"$90,110,679","898,221,525","April 27, 2022",PG,"Leonardo DiCaprio, Adam Driver",Marvel Studios
NF6507,Mortal Kombat,Horror | Thriller,2099,150mins,4.2,6.1,506085,Akira Kurosawa,Italy,Spa,,1393172998,10/05/2017,TV-MA,"Sandra Bullock, Cate Blanchett, Angelina Jolie",Paramount Pictures
NF3543,1917,Crime/Comedy,2022,,5.9,8.7,1108890,Denis Villeneuve,South Korea,Spanish,"$248,936,807",1557030039,20230711,PG,"Robert De Niro, Meryl Streep, Viola Davis, Julia Roberts",Netflix Originals
NF9426,Licorice Pizza (Extended Collector's Edition with Bonus Features and Director's Commentary), Animation,2099,,9.0,,155849,Steven Spielberg,U.S.A,Ita,"$80,158,436","445,977,107",2019-11-14,TV-14,"Chris Evans, Lupita Nyong'o",Paramount Pictures
NF1573,Fight Club,"Horror, Drama",2003,100mins,7.8,,999403,,United Kingdom,ITALIAN,$189177034,136001018,03/04/2017,TV-14,"Meryl Streep, Oscar Isaac",Legendary Pictures
NF7310,Sound of Metal,Thriller/Comedy,1890,94mins,6.7,4.7,4276,,France,Spanish,70675672,1299374601,"July 11, 2024",NC-17,"Morgan Freeman, Chris Evans",Apple TV+
NF1351,Otherhood,comedy,2014,152mins,8.8,9.5,1552071,Christopher Nolan,Germany,GERMAN,$119368216,1790057413,20150517,TV-PG,,
NF7262,Luca,"Adventure,",2000,158 min,4.5,8.7,1136265,Bong Joon-ho,usa,GERMAN,"$175,977,601",319637589,13/01/2019,PG-13,"Sandra Bullock, Margot Robbie, Zendaya, Dwayne Johnson",Pixar Animation Studios
NF9528,Space Jam A New Legacy,COMEDY,2099,155mins,9.1,5.8,603561,Jordan Peele,U.K.,Italian,112454252,"1,104,243,013",2017-02-27,G,"Michael B. Jordan, Florence Pugh, Ryan Reynolds",A24
NF4603,Birdman,"Thriller,",2001,134,6.0,8.7,314318,Tim Burton,Japan,FRENCH,207019016,1482949857,"December 9, 2017",TV-14,"Charlize Theron, Cate Blanchett, Adam Driver",Legendary Pictures
NF2741,Vice, Action,2002,175mins,4.9,,1266169,Christopher Nolan,Japan,Fre,244086590,1772887578,2022-12-20,PG,"Pedro Pascal, Scarlett Johansson, Tom Hanks",Focus Features
NF9449,Coming 2 America,Drama  ,1890,70,8.8,5.1,561962,Guillermo del Toro,India,GERMAN,162475534,,2015-10-25,NR,,Lionsgate
NF6067,ATTICA, Crime,2002,161,7.5,,1717450,Ryan Coogler,Germany,Korean,$27032164,1089768646,20160518,NR,"Denzel Washington, Adam Driver",Amazon Studios
NF3650,Clifford the Big Red Dog,Animation  ,1890,124mins,9.0,8.1,1457058,Zack Snyder,Japan,JAPANESE,"$104,093,759",1588591912,20240821,R,"Ana de Armas, Will Smith",HBO Films
NF4696,Army of the Dead,Drama,2011,N/A,4.2,3.2,1961064,Sofia Coppola,Germany,Fre,"$91,983,331",1764545142,2020-09-26,PG,"Adam Driver, Angelina Jolie, Robert De Niro, Brad Pitt",Universal Pictures
NF3540,Project Power,Adventure | Thriller,2019,N/A,5.7,7.7,521564,Ryan Coogler,usa,French,137576990,203003617,"November 24, 2022",NC-17,"Robert Downey Jr., Brad Pitt, Tom Hanks",Legendary Pictures
NF1441,Holidate,Horror  ,2003,117mins,6.1,,764103,Darren Aronofsky,Japan,SPANISH,100215065,741196719,2022-09-23,R,,Blumhouse Productions
NF9162,He's All That (Extended Collector's Edition with Bonus Features and Director's Commentary),romance,1999,165,7.9,4.2,"1,717,657",,usa,FRENCH,29430611,387542035,20240906,TV-PG,"Morgan Freeman, Charlize Theron",Pixar Animation Studios
NF4079,The Kissing Booth 3!!!,Crime/Comedy,2004,129 min,,,281300,Patty Jenkins,Italy,korean,132421423,351828560,02/04/2018,G,"Zendaya, Scarlett Johansson, Sandra Bullock",Paramount Pictures
NF3139,Judas and the Black Messiah,Romance  ,1992,95mins,4.1,4.1,897260,Bong Joon-ho,France,hindi,235809188,"1,405,816,956",03/05/2020,PG-13,"Timothée Chalamet, Dwayne Johnson",Amazon Studios
NF8331,Alex Rider, Fantasy,1995,3h 5m,8.2,5.0,1556735,Alfonso Cuaron,United States,japanese,241485044,1533868848,2015-11-18,PG,"Michael B. Jordan, Chris Evans, Meryl Streep, Robert Downey Jr.",
NF5054,The Little Things (Extended Collector's Edition with Bonus Features and Director's Commentary), Documentary,2012,181mins,,9.3,1431441,Spike Lee,UK,japanese,$114469163,658344213,20220723,R,"Ryan Reynolds, Al Pacino, Florence Pugh",Blumhouse Productions
NF6095,The Hand of God,Thriller  ,2020,,5.6,8.0,1560943,Steven Spielberg,Japan,French,"$164,438,205",1421725628,2020-05-10,G,"Sandra Bullock, Oscar Isaac, Ana de Armas",20th Century Studios
NF1457,Passing,Animation ,2008,2h 30m,5.6,4.6,1978794,Akira Kurosawa,India,JAPANESE,,445008207,20190907,NR,"Ryan Reynolds, Brad Pitt",Walt Disney Pictures
NF1777,Malcolm & Marie,Horror  ,2017,177mins,4.6,,1247764,Rian Johnson,Italy,Hindi,39969444,1709070280,"September 16, 2016",G,"Charlize Theron, Leonardo DiCaprio, Florence Pugh",Apple TV+
NF6963,The Prestige, Crime,2023,96mins,9.1,-1.0,"1,400,438",Tim Burton,Italy,French,231556811,0,20210823,NC-17,"Michael B. Jordan, Denzel Washington",Pixar Animation Studios
NF1049,Lady Bird,Adventure  ,2020,1h 43m,,,1730419,Taika Waititi,UK,KOREAN,41100501,"1,040,407,305",25/05/2023,TV-PG,"Morgan Freeman, Meryl Streep, Tom Hanks, Ryan Reynolds",Warner Bros.
NF6632,The Lost Daughter,Crime,2014,177mins,9.1,4.6,828064,Steven Spielberg,France,Fre,"$45,372,955",1736256180,02/03/2018,TV-14,"Morgan Freeman, Robert Downey Jr.",Paramount Pictures
NF8586,Hell or High Water ,Comedy ,2008,111 min,,,,Jordan Peele,U.S.A,spanish,171625944,1098057624,20220427,PG,"Pedro Pascal, Sandra Bullock",Legendary Pictures
NF5146,Green Book (Extended Collector's Edition with Bonus Features and Director's Commentary),"Crime,",2008,N/A,6.4,,,Park Chan-wook,France,ITALIAN,11637790,1352236648,25/10/2023,TV-14,"Adam Driver, Sandra Bullock, Charlize Theron, Dwayne Johnson",20th Century Studios
NF3895,The Kissing Booth 3,Romance  ,2010,2h 29m,8.0,,"1,856,258",Ryan Coogler,Japan,Spa,231943857,1483755443,21/01/2017,PG-13,"Ana de Armas, Sandra Bullock, Denzel Washington",Netflix Originals
NF9148,On the Record, Sci-Fi,2016,70mins,9.0,5.4,160011,Billy Wilder,Britain,FRENCH,"$107,069,449",736580140,20151005,TV-14,"Jodie Foster, Will Smith",DreamWorks Animation
NF3865,Ascension,Romance ,2016,80 min,8.5,4.3,,Sofia Coppola,Italy,german,"$147,654,550",0,2019-06-11,NR,,20th Century Studios
NF3273,C'mon C'mon,Animation/Comedy,2024,138 min,7.0,8.9,266174,Steven Spielberg,usa,Ger,161084232,538627264,2023-05-21,TV-MA,"Cate Blanchett, Brad Pitt, Ryan Reynolds, Viola Davis",Pixar Animation Studios
NF1087,Dunkirk,Crime,2010,N/A,4.7,6.9,"955,237",Paul Thomas Anderson,United Kingdom,English,$169769300,1926619494,20161018,TV-MA,"Charlize Theron, Dwayne Johnson, Pedro Pascal",Pixar Animation Studios
NF8300,  A Hero  ,Horror/Comedy,2016,183 min,4.5,9.1,"1,231,505",Sam Raimi,Germany,Hin,141509425,142082551,2024-07-03,NC-17,"Julia Roberts, Ana de Armas, Al Pacino",Marvel Studios
NF1653,A Star Is Born,Documentary | Thriller,2007,75mins,4.1,4.1,189982,Spike Lee,Japan,german,92451437,283892432,"January 7, 2018",TV-PG,"Robert Downey Jr., Tom Hanks, Denzel Washington",DC Films
NF3841,Whiplash,Adventure | Thriller,2020,158mins,9.1,4.0,1240508,Wong Kar-wai,France,SPANISH,"$238,084,857",1024220256,15/03/2022,TV-MA,"Charlize Theron, Denzel Washington, Jodie Foster",DreamWorks Animation
NF4936,Promising Young Woman,Comedy,1999,3h 7m,4.4,6.2,,Sam Raimi,Italy,French,226483389,"1,532,746,738",2023-01-06,PG-13,"Jodie Foster, Cate Blanchett",DreamWorks Animation
NF7560,Room,"Action,",2019,76mins,,3.7,,Park Chan-wook,Germany,HINDI,123200721,1021493260,2017-02-13,PG,"Sandra Bullock, Chris Evans, Scarlett Johansson, Cate Blanchett",20th Century Studios
NF9084,Raya and the Last Dragon,"Fantasy,",2004,,4.4,3.6,"1,238,012",Sofia Coppola,Germany,english,195490785,0,2018-05-22,TV-PG,"Cate Blanchett, Ana de Armas, Leonardo DiCaprio",Netflix Originals
NF7523,ARRIVAL,Comedy/Comedy,2013,,4.3,5.6,1702185,Rian Johnson,Japan,SPANISH,8682814,636469610,20221105,TV-14,"Al Pacino, Sandra Bullock",Paramount Pictures
NF5227,Army of the Dead,Fantasy,2000,139mins,9.4,15.0,1298328,Quentin Tarantino,France,Fre,175707808,1776613744,20210302,TV-14,"Margot Robbie, Angelina Jolie",Blumhouse Productions
NF6437,The Lovebirds,Crime | Thriller,1990,99mins,9.0,7.2,1431513,Wes Anderson,U.K.,HINDI,,1654723961,"September 26, 2020",TV-PG,"Ryan Reynolds, Sandra Bullock",Paramount Pictures
NF8249,  Green Book  ,Fantasy | Thriller,1997,2h 8m,7.9,5.4,,Wes Anderson,Italy,spanish,142935237,1983377936,2015-07-10,TV-MA,,
NF5395,  Sound of Metal  ,ROMANCE,2015,186 min,8.7,7.4,237196,Coen Brothers,United States,Fre,130067042,1456938167,20/03/2022,TV-MA,"Tom Hanks, Al Pacino, Pedro Pascal, Oscar Isaac",DC Films
NF8121,Like Father,Animation,1993,115 min,,3.5,932957,Zack Snyder,Japan,GERMAN,"$30,063,567",210691134,20181214,TV-14,"Cate Blanchett, Pedro Pascal",Universal Pictures
NF5222,I Care a Lot, Crime,2014,193mins,9.3,6.1,57458,Jane Campion,U.K.,german,111209752,1109284364,20230123,R,"Brad Pitt, Timothée Chalamet, Charlize Theron",20th Century Studios
NF2222,Flee,Romance ,2017,183mins,8.7,5.1,1071800,Akira Kurosawa,France,Jap,131339783,516768411,"November 17, 2023",NC-17,"Brad Pitt, Jodie Foster, Florence Pugh, Adam Driver",Lionsgate
NF5003,The Lovebirds,Drama/Comedy,1991,2h 42m,5.0,7.7,1004757,Park Chan-wook,France,Ger,$11215441,"1,204,131,835",20170608,TV-14,"Michael B. Jordan, Julia Roberts, Robert Downey Jr.",Lionsgate
NF8767,Dunkirk,Comedy/Comedy,2002,196mins,6.3,6.2,"1,130,634",Kathryn Bigelow,France,French,91242273,"627,406,834",20150108,G,"Cate Blanchett, Tom Hanks, Oscar Isaac",Columbia Pictures
